scene,idk_1,actual_char,hidden_char,text,text_hira,text_kata
0,448,,,"The wallet I mentioned earlier is similar to this. Since he\nwas carrying it right up until the last moment, the wallet\nhad the same color as him.",さっきの財布なんかがこれに近い。直前まで持っていたのだから、財布にも本人と同じ色が強く残っている。,さっきの財布なんかがこれに近い。直前まで持っていたのだから、財布にも本人と同じ色が強く残っている。
0,448,,,"It is clear evidence that identifies an individual more than\na figure or shape, so even if the appearance is a little bit\nsimilar, it is not possible to mistake it as one's own.",それは姿や形よりも個人を特定する明確な証拠なのだから、外見が少しくらい似ていても、自分の物と勘違いする事はない。,それは姿や形よりも個人を特定する明確な証拠なのだから、外見が少しくらい似ていても、自分の物と勘違いする事はない。
0,448,,,"Maybe it's because I'm so used to it by now that I can\ndistinguish the colors of different people, even if they\nare the same color.",もう慣れてしまったせいか、同じような色だとしても別人の色を区別できるくらいだ。,もう慣れてしまったせいか、同じような色だとしても別人の色を区別できるくらいだ。
0,448,,,However...,,
0,464,Michitaka,,(I wonder what color it is...),,
0,448,,,I hold my hand up to the sky.,,
0,448,,,There's my skin-colored hands and the bright blue sky.,,
0,448,,,"I can't see my ""color"".",,
0,448,,,"The world is filled with so many colors, but I feel as if I am\nthe only one who has become colorless and transparent.",世界にはこんなにも色で溢れているのに、自分だけが無色透明になった気さえしてしまう。,世界にはこんなにも色で溢れているのに、自分だけが無色透明になった気さえしてしまう。
0,464,,,That's why I longed to live alone. A space where no color\nis mixed in reflecting the true expression of a person.,だからこそ、一人暮らしには憧れていた。何の色も混じらない空間は、ありのままの表情を映す。,だからこそ、一人暮らしには憧れていた。何の色も混じらない空間は、ありのままの表情を映す。
0,448,,,I've always wanted to live in such a landscape.,,
0,448,Michitaka,,(I can't see the color... and neither can Ouka.),,
0,448,,,That's why I decided to believe in her.,,
0,456,,,She can't see the colors.,,
0,456,,,"Of course, it's not monochrome. Black and white and gray\nare also great colors, and there are people who have\nsuch colors.",もちろんモノクロという訳じゃない。白黒灰色だって立派な色だし、そうした色を持つ人もいる。,もちろんモノクロという訳じゃない。白黒灰色だって立派な色だし、そうした色を持つ人もいる。
0,456,,,"Like myself, I can only see the colors that she herself\npossesses, and no other traces of her are left behind.",俺自身と同じく彼女自身が持つ色彩だけが見えて、それ以外の痕跡には残らない。,俺自身と同じく彼女自身が持つ色彩だけが見えて、それ以外の痕跡には残らない。
0,456,,,"So when I was told that her image was a reflection of my\nown eyes, I couldn't help but agree.",だから自分自身の見る目が映した像だと言われて、思わず納得したくらいだ。,だから自分自身の見る目が映した像だと言われて、思わず納得したくらいだ。
0,456,,,"... Well, that didn't make her go away.",,
0,456,,,The feelings of those who remain in the building are\nimportant because of how it has been treated.,建物に残った人の想いというのは、そこがどう扱われてきたかが重要になる。,建物に残った人の想いというのは、そこがどう扱われてきたかが重要になる。
0,456,,,I wonder how many feelings have accumulated in Ouka-sou\nif it has been cherished with deep feelings like my\ngrandfather's.,爺さんのように深い思い入れを持って大事にされてきたなら桜花荘に積もった想いはどれだけの物になってるだろう。,爺さんのように深い思い入れを持って大事にされてきたなら桜花荘に積もった想いはどれだけの物になってるだろう。
0,456,,,"If that's the case, maybe what I need to know isn't about\nthe old man, but the history of Ouka-sou itself.",それなら、俺が知るべきは爺さんについてじゃなく、桜花荘の歴史そのものなのかもしれない。,それなら、俺が知るべきは爺さんについてじゃなく、桜花荘の歴史そのものなのかもしれない。
0,464,,,"If you walk from the area of the family restaurant towards\nthe local university, you will find a large public library.",ファミレスの辺りから地元の大学方面に歩くと、大きな私立の図書館がある。,ファミレスの辺りから地元の大学方面に歩くと、大きな私立の図書館がある。
0,448,,,"Last year, when I was taking my exams, I took care of this\nplace to help me catch up, and I remember that the\nfacilities were reasonably good and comfortable.",昨年、受験する時に追い込みで世話になった所で、それなりに設備が良くて快適だった記憶がある。,昨年、受験する時に追い込みで世話になった所で、それなりに設備が良くて快適だった記憶がある。
0,448,,,"Of course, I never had a chance to use the library after\nthat, and I only study when I'm in a pinch before a test,\nso it's not a place I'm familiar with.",もちろん、それ以後は利用する機会なんて無く、勉強もテスト前の切羽詰まった時しかやらない俺にとって、図書館はあまり馴染みのある所じゃない。,もちろん、それ以後は利用する機会なんて無く、勉強もテスト前の切羽詰まった時しかやらない俺にとって、図書館はあまり馴染みのある所じゃない。
0,464,Michitaka,,"""...""",,
0,448,,,So I'm a little uncomfortable with the air being too quiet.,,
0,448,,,"... Well, you can't even say that...",,
0,448,,,I'm going in.,,
0,448,,,A whisper spoken in hushed tones. The faint sound of\npaper being turned.,ひそやかに話す囁き声。紙をめくる微かな音。,ひそやかに話す囁き声。紙をめくる微かな音。
0,448,,,These mixed together create the air of the library.,,
0,448,Michitaka,,"""... Okay.""",,
0,448,,,"When I entered, I didn't recognize it since it was being\ndrowned out by the colors of people walking by.",,
0,448,,,A hint of a familiar color lingered towards the reading\ntable.,,
0,456,,,"Despite the fact that the table was empty, there was no\none around her who wanted to sit down.",席が空いているにも関わらず、彼女の周囲に座ろうとする者はいない。,席が空いているにも関わらず、彼女の周囲に座ろうとする者はいない。
0,456,,,There was an atmosphere in the air as if it was forbidden\nto do so.,,
0,456,,,The girl looked down into the paper with a serious gaze.,,
0,456,,,"It was a very minor action, but it made her stand out.",,
0,456,,,"It's not just because of her flashy looks. Once you have\nseen her, you cannot take your eyes off her.",ともすれば派手に見えるルックスのせいじゃない。一度見たら視線を引きつけられてしまい、不思議と視線が離せなくなる。,ともすれば派手に見えるルックスのせいじゃない。一度見たら視線を引きつけられてしまい、不思議と視線が離せなくなる。
0,456,,,"... Once upon a time, I wondered what the colors I see are.",,
0,456,,,"If that is the life force that humans possess, then how\noutstanding is the girl in front of me?",もしそれが人間が持つ生命力なのだとしたら、目の前の少女はどれほど卓越した物を持っているのだろう。,もしそれが人間が持つ生命力なのだとしたら、目の前の少女はどれほど卓越した物を持っているのだろう。
0,456,,,"The silvery light she possesses is dazzling, and even if you\ndon't see it in color like I do, it shows as a personality\nthat attracts people and doesn't let go.",彼女が持つ銀色の光は眩いほどで、俺のように色で見えなくても、人を惹きつけて離さない個性となって表れている。,彼女が持つ銀色の光は眩いほどで、俺のように色で見えなくても、人を惹きつけて離さない個性となって表れている。
0,456,,,Her name is Inoue Reina.,彼女はいのうえれいな。,彼女は井之上麗奈。
0,456,,,"We're both friends, and we both know each other well.",,
0,456,Reina,,"""... Hmm?""",,
0,456,,,"Reina looks up, as if she noticed me.",,
0,456,,,"As soon as she did, the tense air that had been forming\naround her dissipated, as if her concentration had been\nbroken.",その途端、集中が途切れたのか彼女を中心に形作られていた張りつめた空気が霧散する。,その途端、集中が途切れたのか彼女を中心に形作られていた張りつめた空気が霧散する。
0,456,Reina,,"""What are you laughing about? What's going on?""",,
0,456,,,"The unapproachable vibe Reina has is only there when\nshe's concentrating, for better or worse.",麗奈の持つ近寄りがたい雰囲気は、良くも悪くも集中してる時だけだ。,麗奈の持つ近寄りがたい雰囲気は、良くも悪くも集中してる時だけだ。
0,456,,,"When I talk to her normally, her expression changes and\nshe's still looking around impatiently, trying to figure out\nwhat I've been looking at.",普通に話すと表情はころころと変わるし、今も俺が何を見てたのか知ろうと、辺りをせわしなく見渡している。,普通に話すと表情はころころと変わるし、今も俺が何を見てたのか知ろうと、辺りをせわしなく見渡している。
0,456,,,"Despite her ladylike appearance, it was always the case\nthat her every gesture was that of a petty bourgeoisie.",お嬢様然とした容姿なのに、仕草の一つ一つが小市民的なのはいつもの事だった。,お嬢様然とした容姿なのに、仕草の一つ一つが小市民的なのはいつもの事だった。
0,456,Michitaka,,"""It's nothing. This is a rare place to meet. Are you\nstudying?""",「何でもない。それより珍しい所で会うな。そっちは自習？」,「何でもない。それより珍しい所で会うな。そっちは自習？」
0,456,Reina,,"""Of course not. I'm uncomfortable with you standing next\nto me, so why don't you sit down too?""",「そんな訳ないでしょう。それより、隣に立たれると落ち着かないから、道隆も座りなさいよ」,「そんな訳ないでしょう。それより、隣に立たれると落ち着かないから、道隆も座りなさいよ」
0,456,Michitaka,,"""That's fine, but...""",,
0,456,,,I looked around.,,
0,456,,,I wondered if she had a companion.,,
0,456,Reina,,"""There's no one else here. Don't be so jumpy. It's like\nyou're trying to get into a house with a guard dog.""",「誰もいないわよ。そんなにビクビクするんじゃないの。番犬でもいる家に入り込もうとしてるみたいよ」,「誰もいないわよ。そんなにビクビクするんじゃないの。番犬でもいる家に入り込もうとしてるみたいよ」
0,456,Michitaka,,"""Watchdog...? They don't like me.""",「番犬......か。俺、嫌われてるからなぁ」,「番犬......か。俺、嫌われてるからなぁ」
0,456,,,I chuckled and sat down on an empty seat.,,
0,456,Reina,,"""...""",,
0,456,,,A puzzled expression appeared on her face at my casual\ncomment.,,
0,456,,,"It's hard to say, it's troubling, it's awkward. It was a\nmixture of multiple emotions, yet it seemed to want to say\nsomething.",何とも言い難い、困ったような、気まずいような。それでいて何か言いたげな、複数の感情が入り混じっている。,何とも言い難い、困ったような、気まずいような。それでいて何か言いたげな、複数の感情が入り混じっている。
0,456,Reina,,"""So don't you think it's ridiculous that Michitaka is so\nreserved that he can't even speak to me these days?""",「それで道隆が遠慮して、最近はまともに話も出来なくなってるのは馬鹿らしいと思わない？」,「それで道隆が遠慮して、最近はまともに話も出来なくなってるのは馬鹿らしいと思わない？」
0,456,Michitaka,,"""We've talked about this. We're talking""",,
0,456,Reina,,"""... That's not what I meant. Well, it's just that this whole\nexchange is making me uncomfortable.""",「......そういう事じゃないんだけど。ま、こんなやり取りをしてても不愉快になるだけね」,「......そういう事じゃないんだけど。ま、こんなやり取りをしてても不愉快になるだけね」
0,456,Michitaka,,"""I don't mean to upset you.""",,
0,456,Reina,,"""Don't go back to that. You don't have to continue. You're\na total airhead.""",「話を戻すんじゃないわよ。続けなくていいわよ。まったく空気読めないわね」,「話を戻すんじゃないわよ。続けなくていいわよ。まったく空気読めないわね」
0,456,,,I was... pissed off.,,
0,456,,,"Anyway, I'm all for changing the subject. Now there's a\nsuitable topic for that.",ともあれ話を変えるのは大歓迎だ。今ならそれにふさわしい話題もある。,ともあれ話を変えるのは大歓迎だ。今ならそれにふさわしい話題もある。
0,456,Michitaka,,"Oh, yeah. I'm late to tell you, but I've started living on my\nown.""",,
0,456,Reina,,"""Yeah.""",,
0,456,Michitaka,,"""I'm done moving, so--""",,
0,464,,,"Before I could finish, Reina left her seat.",,
0,448,,,It was a very loud voice in the quiet library.,,
0,448,Reina,,"%99""Why didn't you tell me? What do you mean, you couldn't\ntell me? If I don't know about it, then why didn't you use my\ncompany to find a room? Why not? Answer me quickly!""%r",「何で言わないのよっ！　というか、先に知らせないってどういう事！？　それ以前に私が知らないって事は、部屋を探すのにうちを使わなかったの？　何でよっ。早く答えなさいっ」,「何で言わないのよっ！　というか、先に知らせないってどういう事！？　それ以前に私が知らないって事は、部屋を探すのにうちを使わなかったの？　何でよっ。早く答えなさいっ」
0,448,Michitaka,,"""Hey. Hey, Reina.""",,
0,448,Reina,,"%99""Shut up and don't call me that, you heartless bastard. Why\ndidn't you let me know? Moving takes a lot of time, money and\neffort, and you need help, so why don't I know?""%r",「うるさい、気安く呼ぶな薄情者。大体なんで知らせないの？引越しするって手間もお金も時間も掛かるし、手伝いも必要でしょうに、なんで私が知らないのよっ」,「うるさい、気安く呼ぶな薄情者。大体なんで知らせないの？引越しするって手間もお金も時間も掛かるし、手伝いも必要でしょうに、なんで私が知らないのよっ」
0,448,Reina,,"%76""I mean, what are you going to do for the new school year? Are you going to transfer\nto another school? Is today the last time you're going to say goodbye before that? Oh\nmy god! There's no time for a farewell party then. Why are you being so random?""%r",「というかアンタ新学期どうするの？　まさか転校するの？今日はその前の最後の挨拶って訳？　ああもう！　それじゃ送別会もする時間ないじゃない。なんでこう適当なのよっ」,「というかアンタ新学期どうするの？　まさか転校するの？今日はその前の最後の挨拶って訳？　ああもう！　それじゃ送別会もする時間ないじゃない。なんでこう適当なのよっ」
0,448,Michitaka,,"""Because I don't want to.""",,
0,448,Reina,,"%86""It's usually the aunts and uncles, too. I think they should have contacted\nme first, but why hasn't anyone? If we didn't meet by chance, does that\nmean I was the only one who didn't know? Maybe they didn't like me?""%r",「大体おじさんとおばさんもよね。真っ先に連絡あってもいいと思うのに、なんで誰からも無いのよ。偶然会わなかったら私だけずっと知らなかったって事？　もしかして嫌われてた？」,「大体おじさんとおばさんもよね。真っ先に連絡あってもいいと思うのに、なんで誰からも無いのよ。偶然会わなかったら私だけずっと知らなかったって事？　もしかして嫌われてた？」
0,448,Michitaka,,"""No, it's not. They don't hate you at all.""",,
0,448,Reina,,"""That's right. I think so too. If they don't like me now, I'm\ngoing to lose faith in people and get depressed.""",「そうよね。私だってそう思う。これで今まで嫌われてたなら人間不信になって落ち込むわよ」,「そうよね。私だってそう思う。これで今まで嫌われてたなら人間不信になって落ち込むわよ」
0,448,Reina,,"""Then why don't I know? Tell me right here and now what\nyou're planning to do.""",「じゃあ何で私が知らないのよ。あんたどういうつもりなのか今ここで言ってみなさいよっ」,「じゃあ何で私が知らないのよ。あんたどういうつもりなのか今ここで言ってみなさいよっ」
0,448,Michitaka,,"""Just calm down, okay?""",,
0,448,Reina,,"""Huh? Are you saying this looks like I'm not calm?""",,
0,448,Michitaka,,"""Everyone's watching. Just calm down, please...!""",,
0,448,Reina,,"""...... Ah...""",,
0,448,,,These words finally made her realize what she was doing.,,
0,448,,,Reina's white face turns red as soon as she sees it.,,
0,456,,,The face that had been so close to me that our noses\nalmost collided moved away.,,
0,456,,,"With reddened cheeks, she apologized to the people\naround her for making a scene.",頬を赤く染めたまま、周囲に向かって、騒がしくした事を謝罪していた。,頬を赤く染めたまま、周囲に向かって、騒がしくした事を謝罪していた。
0,456,Michitaka,,"""I thought they were going to eat me alive.""",,
0,456,Reina,,"""What do you mean by...? Because that's what I do in\nsome cases.""",「......で、どういう事なのよ。場合によってはそうするからね」,「......で、どういう事なのよ。場合によってはそうするからね」
0,456,Michitaka,,"""I said I moved, but we're in the same city. So I won't be\nchanging schools, and it won't change when the new\nschool year starts, either.""",「引っ越したって言っても、同じ市内なんだよ。だから転校もしないし、新学期になっても変わらない」,「引っ越したって言っても、同じ市内なんだよ。だから転校もしないし、新学期になっても変わらない」
0,456,Michitaka,,"""You know, when we were kids, we used to go to Shione's\ngrandfather's house for fun. I started living alone in a\nhouse over there.""",「昔、ガキの頃に汐音の爺さんの家に遊び行っただろ。あそこの部屋で一人暮らし始めたんだよ」,「昔、ガキの頃に汐音の爺さんの家に遊び行っただろ。あそこの部屋で一人暮らし始めたんだよ」
0,456,Reina,,"""... at Ouka-sou?""",,
0,456,Michitaka,,"""Oh, you remember.""",,
0,456,Reina,,"""Yeah, well...""",,
0,456,,,"This time, she wrinkled her brow, a change from earlier.",,
0,456,Reina,,"%96""So you're not changing schools, you're not leaving town, you're\nmoving in next door to your beautiful women, you're not being\nwatched by your parents, and you're having a good time.""%r",「じゃあ転校もせず街を出る訳でもなく、美人姉妹の隣に引っ越して親の目もなくなって楽しい毎日って訳なのね」,「じゃあ転校もせず街を出る訳でもなく、美人姉妹の隣に引っ越して親の目もなくなって楽しい毎日って訳なのね」
0,456,Michitaka,,"""That's what I wanted...""",,
0,456,Reina,,"""You're not?""",,
0,456,Michitaka,,"""There's a lot going on over there too. Ouka-sou is an\nold building, so I thought I'd see if I could find out its\norigins.""",「こっちも色々とあってな。桜花荘って古い建物だから由来を調べられないかと思ったんだ」,「こっちも色々とあってな。桜花荘って古い建物だから由来を調べられないかと思ったんだ」
0,456,Reina,,"""... Oh, yeah.""",,
0,456,,,I suddenly felt uncomfortable as she nodded her head in a\nstrangely serious manner.,,
0,456,,,"Even though we hadn't had a chance to talk lately, I\nthought Reina would laugh at the idea of me doing serious\nresearch.",最近はゆっくり話す機会が無かったとはいえ、麗奈の事だから俺が真面目に調べ物なんて――と笑うかと思ったのに。,最近はゆっくり話す機会が無かったとはいえ、麗奈の事だから俺が真面目に調べ物なんて――と笑うかと思ったのに。
0,456,Michitaka,,"""I'm surprised, though. I've never seen Reina as upset as she was earlier. I don't think I've ever seen Reina so\nupset before.""",「でも意外だな。さっきみたく慌てるなんて。麗奈が取り乱す所なんて、初めてみたかもしれない」,「でも意外だな。さっきみたく慌てるなんて。麗奈が取り乱す所なんて、初めてみたかもしれない」
0,456,Reina,,"""...""",,
0,456,,,Reina glares at me and raises one hand.,,
0,456,,,-- Pish.,,
0,456,Michitaka,,"""Ouch.""",,
0,456,,,She flicked the tip of my nose with her finger.,,
0,456,Reina,,"%94""If you think I'm so heartless that I wouldn't be so upset if I heard\nthat my best friend, who I've known since I was 2 years old, was\ngoing to disappear, I'm going to hit you with my fist next time.""%r",「２歳から付き合いのある親友がいなくなるかもって聞いて取り乱さないくらい薄情な女だと思ってたっていうなら、次は拳でぶん殴るわよ」,「２歳から付き合いのある親友がいなくなるかもって聞いて取り乱さないくらい薄情な女だと思ってたっていうなら、次は拳でぶん殴るわよ」
0,456,Michitaka,,"""I'm sorry. I was out of line. But I really thought it was\nunusual.""",「悪かったよ。言いすぎた。でもホントに珍しいと思ったんだ」,「悪かったよ。言いすぎた。でもホントに珍しいと思ったんだ」
0,456,Reina,,"""Hmm. You humiliated me because of this.""",,
0,456,,,Reina's white cheeks were stained with vermilion.,,
0,456,,,"It's not that I wanted such a dramatic reaction, but it's\ntrue that her words made me happy.",ここまで劇的な反応が欲しかった訳じゃないけど、彼女の言葉は嬉しかったのは事実だ。,ここまで劇的な反応が欲しかった訳じゃないけど、彼女の言葉は嬉しかったのは事実だ。
0,456,,,"I've known Reina for a long time, more than Shione in\nyears alone.",,
0,456,,,"%80We used to play together in the neighborhood park even before we went to the\nsame kindergarten. We've been playing together since we were two years old, as\nshe said, and we've been together for more than ten years now.%r",同じ幼稚園に通う前から近所の公園で一緒に遊んでた仲だ。彼女の言う通り２歳の頃からだか、もう十数年は共に過ごしている間柄だ。,同じ幼稚園に通う前から近所の公園で一緒に遊んでた仲だ。彼女の言う通り２歳の頃からだか、もう十数年は共に過ごしている間柄だ。
0,456,,,"%88However, we were in different classes last year, and due to various\nreasons, we didn't have many opportunities to talk to each other, but we\nhaven't known each other long enough to feel distant from each other.%r",とはいえ、昨年はクラスも違っていたし、色々とあって話す機会は少なくなっていたけれど、今さらそんな事で距離を感じるほど、付き合いが短い訳じゃない。,とはいえ、昨年はクラスも違っていたし、色々とあって話す機会は少なくなっていたけれど、今さらそんな事で距離を感じるほど、付き合いが短い訳じゃない。
0,456,Reina,,"""I hope I didn't scare you with all that... nonsense.""",,
0,456,Michitaka,,"""It's just that you were surprised... it's nothing...""",,
0,456,,,I want you to stop clenching your fists and blowing on\nthem.,,
0,456,Michitaka,,"""Anyway, since that's the reason, you should come visit\nme sometime. I'm sure you'll miss it.""",「ともかくそんな理由だから、今度遊びにでも来いよ。麗奈にとっても懐かしい所だろ」,「ともかくそんな理由だから、今度遊びにでも来いよ。麗奈にとっても懐かしい所だろ」
0,456,Reina,,"""As much as I'd like to...""",,
0,456,Michitaka,,"""...?""",,
0,456,Reina,,"""It's nothing. I should get going. You want some lunch?""",,
0,456,Michitaka,,"""I had a meal with Shione before I came here.""",,
